{
  "contract": "DEVAM_RITUAL_OBSERVANCE_CONTENT_V1",
  "lane_id": "ashtami-shraddha-north-west-authority-router-2027-v1",
  "observance_slugs": [
    "ashtami-shraddha"
  ],
  "applicability": {
    "region_codes": [
      "north-india",
      "west-india",
      "IN-DL",
      "IN-HR",
      "IN-RJ",
      "IN-UP",
      "IN-UK",
      "IN-PB",
      "IN-MH",
      "IN-GJ",
      "IN-WB",
      "IN-BR",
      "IN-CG",
      "IN-KA",
      "IN-TN",
      "IN-KL",
      "IN-OD",
      "IN-AP"
    ],
    "tradition_codes": [
      "ashtami-shraddha",
      "north-west-pitru-paksha",
      "family-specific-hindu",
      "authority-routed-shraddha"
    ],
    "institution_codes": [],
    "settings": [
      "individual",
      "household",
      "family_led",
      "temple"
    ],
    "family_practice_overrides_generic_guidance": true,
    "material_context_questions": [
      "Which city, accepted Pitru Paksha calendar, local Ashtami interval and aparaahna overlaps apply?",
      "Which ancestor and matching death tithi are voluntarily established by family knowledge?",
      "Does a named current family or religious authority accept this formal applicability?",
      "Who may lead, participate or abstain, and what grief, health, privacy, child/dependent, water, fire, crowd, accessibility, legal or cost limits apply?"
    ],
    "context_pairs": [
      {
        "region_code": "north-india",
        "tradition_code": "ashtami-shraddha",
        "observance_slug": "ashtami-shraddha"
      },
      {
        "region_code": "west-india",
        "tradition_code": "ashtami-shraddha",
        "observance_slug": "ashtami-shraddha"
      },
      {
        "region_code": "IN-WB",
        "tradition_code": "ashtami-shraddha",
        "observance_slug": "ashtami-shraddha"
      },
      {
        "region_code": "IN-BR",
        "tradition_code": "ashtami-shraddha",
        "observance_slug": "ashtami-shraddha"
      },
      {
        "region_code": "IN-CG",
        "tradition_code": "ashtami-shraddha",
        "observance_slug": "ashtami-shraddha"
      },
      {
        "region_code": "IN-KA",
        "tradition_code": "ashtami-shraddha",
        "observance_slug": "ashtami-shraddha"
      },
      {
        "region_code": "IN-TN",
        "tradition_code": "ashtami-shraddha",
        "observance_slug": "ashtami-shraddha"
      },
      {
        "region_code": "IN-KL",
        "tradition_code": "ashtami-shraddha",
        "observance_slug": "ashtami-shraddha"
      },
      {
        "region_code": "IN-MH",
        "tradition_code": "ashtami-shraddha",
        "observance_slug": "ashtami-shraddha"
      },
      {
        "region_code": "IN-OD",
        "tradition_code": "ashtami-shraddha",
        "observance_slug": "ashtami-shraddha"
      },
      {
        "region_code": "IN-AP",
        "tradition_code": "ashtami-shraddha",
        "observance_slug": "ashtami-shraddha"
      }
    ],
    "observance_context_notes": [
      {
        "observance_slug": "ashtami-shraddha",
        "language_code": "en",
        "note": "Selected-state safe authority router. This lane remains separate from Jivitputrika, Mahalakshmi, Radha Ashtami and Durga Ashtami."
      },
      {
        "observance_slug": "ashtami-shraddha",
        "language_code": "hi",
        "note": "Selected-state safe authority router। यह lane जीवित्पुत्रिका, महालक्ष्मी, राधा अष्टमी और दुर्गा अष्टमी से अलग रहती है।"
      }
    ]
  },
  "calendar": {
    "resolution_source_ids": [
      "drik-pitru-paksha-2027",
      "drik-ashtami-shraddha-2027",
      "nirnayasindhu-1865-mahalaya",
      "devam-pitru-tithi-batch-research"
    ],
    "timing_kind": "mixed",
    "location_aware": true,
    "tradition_aware": true,
    "decision_rule_id": "pitru-paksha-ashtami-greater-aparaahna-overlap-named-authority-v1",
    "closing_decision_rule_id": "named-owner-close-or-private-no-result-close-v1",
    "live_schedule_required": true,
    "freshness_note": "23 September 2027 is a reviewed 2027 North-India fixture only. Recompute tithi-aparaahna for city/year and verify current formal schedules."
  },
  "sources": [
    {
      "source_id": "drik-pitru-paksha-2027",
      "title": "2027 Pitru Paksha Shraddha dates",
      "publisher": "Drik Panchang",
      "source_role": "Current practitioner calendar fixture and tithi sequence",
      "rights_lane": "citation_only",
      "url": "https://www.drikpanchang.com/shraddha/pitru-paksha-shraddha-dates.html?lang=en&year=2027",
      "artifact_sha256": null,
      "citation_coordinates": null
    },
    {
      "source_id": "drik-ashtami-shraddha-2027",
      "title": "2027 Ashtami Shraddha page",
      "publisher": "Drik Panchang",
      "source_role": "Current timing, identity, aliases and attributed applicability",
      "rights_lane": "citation_only",
      "url": "https://www.drikpanchang.com/shraddha/tithi/ashtami-shraddha-date-time.html?year=2027",
      "artifact_sha256": null,
      "citation_coordinates": null
    },
    {
      "source_id": "utsav-pitra-paksha",
      "title": "Pitra Paksha",
      "publisher": "Ministry of Tourism, Government of India",
      "source_role": "Current living-observance context, not formal vidhi",
      "rights_lane": "citation_only",
      "url": "https://utsav.gov.in/public/view-event/pitra-paksha-1",
      "artifact_sha256": null,
      "citation_coordinates": null
    },
    {
      "source_id": "nirnayasindhu-1865-mahalaya",
      "title": "Nirnayasindhu (1865), Mahalaya section",
      "publisher": "Retained Devam source carrier",
      "source_role": "Fixed historical textual context; not universal modern instructions",
      "rights_lane": "internal_only",
      "url": null,
      "artifact_sha256": "a632f570153cb77802b85fdc22e54e00f217960b1d848ee640dd9e610327f02b",
      "citation_coordinates": null
    },
    {
      "source_id": "max-muller-katha-upanishad",
      "title": "Katha Upanishad, Sacred Books of the East volume 15 (1884)",
      "publisher": "Wikisource transcription of public-domain Max Muller translation",
      "source_role": "Fixed lawful Nachiketa-Yama narrative expression",
      "rights_lane": "product_cleared",
      "url": "https://en.wikisource.org/wiki/Sacred_Books_of_the_East/Volume_15/Katha-upanishad",
      "artifact_sha256": null,
      "citation_coordinates": null
    },
    {
      "source_id": "devam-pitru-remembrance",
      "title": "Pitru Paksha Delhi remembrance content",
      "publisher": "Devam",
      "source_role": "Existing privacy, grief and no-result boundaries",
      "rights_lane": "internal_only",
      "url": null,
      "artifact_sha256": null,
      "citation_coordinates": null
    },
    {
      "source_id": "devam-selected-scope",
      "title": "Ritual-calendar selected scope",
      "publisher": "Devam",
      "source_role": "Frozen denominator evidence",
      "rights_lane": "internal_only",
      "url": null,
      "artifact_sha256": null,
      "citation_coordinates": null
    },
    {
      "source_id": "devam-pitru-tithi-batch-research",
      "title": "Pitru Paksha tithi batch evidence matrix",
      "publisher": "Devam",
      "source_role": "Batch synthesis, contradiction register and major-variant threshold",
      "rights_lane": "internal_only",
      "url": null,
      "artifact_sha256": null,
      "citation_coordinates": null
    },
    {
      "source_id": "devam-sarva-pitru-lane",
      "title": "Sarva Pitru Amavasya authority router",
      "publisher": "Devam",
      "source_role": "Unknown-date and fallback owner boundary",
      "rights_lane": "internal_only",
      "url": null,
      "artifact_sha256": null,
      "citation_coordinates": null
    },
    {
      "source_id": "india-emergency-112",
      "title": "Emergency Response Support System",
      "publisher": "Government of India",
      "source_role": "Immediate danger and emergency boundary",
      "rights_lane": "citation_only",
      "url": "https://112.gov.in/about",
      "artifact_sha256": null,
      "citation_coordinates": null
    }
  ],
  "localized_content": [
    {
      "language_code": "en",
      "observance_slugs": [
        "ashtami-shraddha"
      ],
      "title": "Ashtami Shraddha",
      "short_answer": "First confirm city, accepted Panchang, local Ashtami-aparaahna and ancestor applicability; 23 September 2027 is only a 2027 fixture. If formal authority is unresolved, normal care, the two labelled stories, private memory/silence and no invented rite are a complete answer.",
      "significance": {
        "text": "Ashtami Shraddha is a source-attributed tithi remembrance route, not one national procedure. This lane remains separate from Jivitputrika, Mahalakshmi, Radha Ashtami and Durga Ashtami.",
        "source_ids": [
          "drik-pitru-paksha-2027",
          "drik-ashtami-shraddha-2027",
          "utsav-pitra-paksha",
          "nirnayasindhu-1865-mahalaya",
          "max-muller-katha-upanishad",
          "devam-pitru-remembrance",
          "devam-selected-scope",
          "devam-pitru-tithi-batch-research",
          "devam-sarva-pitru-lane",
          "india-emergency-112"
        ],
        "scope_note": "Safe authority router; formal vidhi remains owner-scoped."
      },
      "origin_narratives": [
        {
          "narrative_id": "ashtami-tithi-identity-en",
          "title": "Ashtami Shraddha: tithi identity",
          "summary": "Current practitioner material identifies Ashtami Shraddha (Ashtami Shraddha) through Ashwina Krishna Ashtami. This lane remains separate from Jivitputrika, Mahalakshmi, Radha Ashtami and Durga Ashtami. The reviewed 23 September 2027 result is a 2027 North-India fixture, not a portable date, universal performer rule or promised benefit.",
          "tradition_scope": "Current location-aware practitioner identity",
          "source_ids": [
            "drik-ashtami-shraddha-2027",
            "drik-pitru-paksha-2027",
            "utsav-pitra-paksha",